{
  "source_kind": "coordinator_artifact",
  "repo": ".claude-prime",
  "ref": { "branch": "work/macbookair/2026-06-17to22", "sha": "647732fa" },
  "path": "state/handoffs/2026-06-21_210002_roadmap-work-cockpit-2026-06-21-tc-2.md",
  "observed_at": "2026-06-22T03:06:15Z",
  "derivation": "parsed"
}
